kinh doanh thương mại,thương mại
thương mại điện tử,thương mại
thống kê dữ liệu,văn phòng
kế hoạch,quản lý
gắn kết nhân viên,hr
dịch vụ tài chính,tài chính
system,it system
thiết kế kiến trúc,kiến trúc
thiết kế web,it web development
thiết kế nội ngoại thất,kiến trúc
đào tạo và phát triển,giáo dục
chăm sóc sức khoẻ,y tế
quy hoạch,bất động sản
biên phiên dịch,phiên dịch
họa viên kiến trúc,kiến trúc
tiếp thị trực tuyến,marketing
thiết kế nội thất,kiến trúc
software testing,it software testing
luật tài chính ngân hàng thương mại,luật pháp
chăm sóc sức khỏe,y tế
tiếp thị thương mại,tiếp thị
phát triển kinh doanh,thương mại
phát triển thị trường,thương mại
pg,người mẫu
kế toán doanh thu,kế toán
đào tạo,giáo dục
kế toán công nợ,kế toán
kế toán quản trị,kế toán
kế toán thanh toán,kế toán
thư ký pháp lý,thư kí
giao nhận,logistics
điều phối,logistics
kế toán tổng hợp,kế toán
kế toán tài chính,kế toán
pb,người mẫu
quầy bar,bar
kế toán chi phí,kế toán
kế toán thuế,kế toán
ai,it ai
ngư,thuỷ hải sản
vận hành sản xuất,quản lý
quản lý công nghệ thông tin,quản lý
quản lý sản xuất,quản lý
quản trị hiệu suất,quản lý
quản lý khu vực,quản lý
đồ uống,ăn uống
quản lý thương hiệu,quản lý
dược,dược phẩm
quản lý đơn hàng,quản lý
quản lý chuỗi cung ứng,logistics
quản lý cửa hàng,quản lý
quản lý kho,quản lý
quản lý căn hộ,bất động sản
quản lý quan hệ khách hàng,quản lý
quản lý f,quản lý
quản lý thi hành pháp luật,pháp lý
quản lý tài sản,dịch vụ tài chính
quản lý đội xe,quản lý
quản lý điều hành,quản lý
quản lý dự án công nghệ,quản lý
quản lý quỹ,dịch vụ tài chính
quản lý tài khoản khách hàng,dịch vụ tài chính
quản lý dự án,quản lý
quản lý giáo dục,quản lý
đại lý du lịch,du lịch
quản lý cấp cao,quản lý
quản lý chất lượng,quản lý
quản lý sự kiện,quản lý
bán sỉ,kinh doanh
da giày,dệt may
quản lý văn phòng,quản lý
nông,nông nghiệp
vận tải đường sắt,logistics
công ty kinh doanh lữ hành,du lịch
bộ phận tiền sảnh,tiếp tân
kho vận,logistics
dịch vụ ăn uống,ăn uống
hoạch định,quản lý
trợ lý kinh doanh,trợ lý
dịch vụ vận tải công cộng,logistics
định giá,thẩm định
kho bãi,logistics
cầu đường,xây dựng
phụ bếp,nhà hàng
phục vụ,tạp vụ
giám thẩm định,thẩm định
chăm sóc khách hàng,dịch vụ khách hàng
quảng cáo,marketing
phần mềm máy tính,it software
vận tải đường bộ,logistics
bao tiêu,kinh doanh
dịch vụ sinh viên,dịch vụ
định phí bảo hiểm,bảo hiểm
dịch vụ hỗ trợ khách hàng,dịch vụ khách hàng
dịch vụ hàng không,dịch vụ
luật thuế,luật pháp
nhập liệu,văn phòng
call center,dịch vụ khách hàng
tuyển dụng,hr
tín dụng,ngân hàng
tư vấn,dịch vụ khách hàng
trợ lý luật,pháp luật
thu mua,kinh doanh
xử lý chất thải,môi trường
nhân sự,hr
chất thải,môi trường
quản trị cơ sở dữ liệu,it database admin
quản lý cơ sở vật chất,quản lý
luật sở hữu trí tuệ,pháp lý
pha chế,ăn uống
nhân sự tổng hợp,hr
luật,pháp lý
trợ lý bán lẻ,trợ lý
phần cứng máy tính,it helpdesk
devops engineer,it devops
thư ký luật,pháp lý
nhập khẩu,logistics
bồi thường bảo hiểm,bảo hiểm
quản lý tiêu chuẩn và chất lượng,quản lý
bán lẻ,bán hàng
xuất nhập khẩu,logistics
lâm,lâm nghiệp
spa,làm đẹp
ux,it ux
ngo,phi chính phủ
ceo,quản lý
pr,marketing
khu công nghiệp,công nghiệp
phân tích kinh doanh,kinh doanh
kĩ thuật điện,điện
sản xuất chương trình,media
kỹ thuật viên y tế,y tế
quy hoạch đô thị,bất động sản
truyền thông,media
cho thuê,kinh doanh
help desk,it help desk
tư vấn rủi ro,quản lý
quản trị hàng tồn kho,quản lý
đặt phòng khách sạn,khách sạn
ngành nghề khác,khác
điều trị đa khoa,y tế
kỹ thuật ứng dụng,it
giảng dạy,giáo dục
chuyển đổi số,it
chứng khoán,tài chính
kỹ thuật ô tô,ô tô
xuất bản,in ấn
công nghệ sinh học,sinh học
đầu tư tài chính,tài chính
tiếp thị nội dung,marketing
đạo diễn nghệ thuật,nghệ thuật
bác sĩ,y tế
phân tích thị trường,kinh doanh
nghiên cứu học thuật,nghiên cứu
điều trị nội trú,y tế
tư vấn pháp lý,pháp lý
general management,quản lý
phúc lợi,hr
phát triển dự án,quản lý
data analyst,it data analyst
nghề nghiệp khác,khác
việc làm bán hàng,bán hàng
hỗ trợ học viên,giáo dục
sáng tạo nghệ thuật,nghệ thuật
tư vấn giáo dục,giáo dục
thiết kế công nghiệp,công nghiệp
phát triển bất động sản,bất động sản
ui design,thiết kế đồ hoạ
bảo mật công nghệ thông tin,it cyber security
giao dịch chứng khoán,tài chính
hành chính văn phòng,văn phòng
báo cáo tài chính,kế toán
công nghệ thông tin,it
công nghệ thực phẩm,thực phẩm
cloud,it
hướng khách hàng,dịch vụ khách hàng
tk nội thất,kiến trúc
bảo vệ,an ninh
bảo lãnh,hành chính
thủ tục hải quan,hành chính
bán hàng qua điện thoại,telesales
đầu bếp,nhà hàng
viễn thông,bưu chính viễn thông
giao nhận hàng hóa,logistics
điều hành,quản lý
kỹ thuật môi trường,môi trường
đầu tư,kinh tế
phân tích hệ thống,it phân tích hệ thống
phát triển sản phẩm,quản lý
vệ sinh buồng phòng,tạp vụ
data engineer,it data engineer
kd bất động sản,bất động sản
điều hành sản xuất,quản lý
cơ khí tự động hoá,tự động hoá
chuỗi cung ứng,logistics
vận hành máy móc,công nghiệp
phân phối dược phẩm,dược phẩm
phân tích dự án bất động sản,bất động sản
bán hàng kỹ thuật,bán hàng
phát triển sản phẩm may mặc,thời trang
kỹ thuật hóa học,hóa học
vận chuyển giao nhận,logistics
giao thông vận tải,logistics
hướng dẫn viên du lịch,du lịch
